[
  {"agent_id":"copilot","condition":"V6+RAW","case_id":"V71-HIST-01","query_category":"historical_recall","answer":"PostgreSQL was chosen for billing because auditability mattered more than DynamoDB's lower migration effort. DynamoDB was tried, but the migration failed because conditional-update semantics did not match the existing transaction flow; Claude later confirmed the failure after reviewing integration-test output.","correctness":{"factual":true,"temporal":true,"relationship":true,"ambiguity":null,"conflict":null,"negative_knowledge":null,"provenance":true},"unsupported_claims":0,"evidence_used":["M-E0005","M-E0067","M-E0141","MREL-BILLING-01","MREL-BILLING-02","E0005","E0067","E0141"],"retrieved_chunks":[],"input_tokens":null,"latency_ms":null},
  {"agent_id":"copilot","condition":"V6+RAW","case_id":"V71-DEC-01","query_category":"decision_continuity","answer":"The initial Redis test increased cache invalidation complexity, so it was abandoned. A narrower retry later produced negligible latency improvement.","correctness":{"factual":true,"temporal":true,"relationship":true,"ambiguity":null,"conflict":null,"negative_knowledge":null,"provenance":null},"unsupported_claims":0,"evidence_used":["M-E0178","M-E0263","M-E0731","MREL-REDIS-01","MREL-REDIS-02","E0178","E0263","E0731"],"retrieved_chunks":[],"input_tokens":null,"latency_ms":null},
  {"agent_id":"copilot","condition":"V6+RAW","case_id":"V71-ACT-01","query_category":"action_outcome","answer":"The first invoice export attempt timed out after 18 minutes. Exports were switched to asynchronous jobs, and the first full customer batch then completed successfully.","correctness":{"factual":true,"temporal":true,"relationship":true,"ambiguity":null,"conflict":null,"negative_knowledge":null,"provenance":null},"unsupported_claims":0,"evidence_used":["M-E0356","M-E0622","M-E1033","E0356","E0622","E1033"],"retrieved_chunks":[],"input_tokens":null,"latency_ms":null},
  {"agent_id":"copilot","condition":"V6+RAW","case_id":"V71-TIME-01","query_category":"temporal_state","answer":"The sequence was polling as the temporary compatibility path, then webhooks, then temporarily disabled webhooks because duplicate deliveries caused reconciliation errors, and finally re-enabled webhooks after idempotency handling. The latest state is webhooks re-enabled.","correctness":{"factual":true,"temporal":true,"relationship":true,"ambiguity":null,"conflict":null,"negative_knowledge":null,"provenance":true},"unsupported_claims":0,"evidence_used":["M-E0233","M-E0401","M-E0887","M-E1190","MSTATE-WEBHOOK","E0233","E0401","E0887","E1190"],"retrieved_chunks":[],"input_tokens":null,"latency_ms":null},
  {"agent_id":"copilot","condition":"V6+RAW","case_id":"V71-AMB-01","query_category":"ambiguity","answer":"The reference remains unresolved between Rahul and Arjun; both the memory and linked raw evidence leave 'he' unresolved.","correctness":{"factual":true,"temporal":null,"relationship":null,"ambiguity":true,"conflict":null,"negative_knowledge":null,"provenance":true},"unsupported_claims":0,"evidence_used":["M-E0312","M-E0515","MAMB-HE","E0312","E0515"],"retrieved_chunks":[],"input_tokens":null,"latency_ms":null},
  {"agent_id":"copilot","condition":"V6+RAW","case_id":"V71-CONFLICT-01","query_category":"conflict","answer":"Claude's transaction-semantics explanation was initially an inference, and Rahul later confirmed it as the reason the DynamoDB migration was abandoned. The belief status is confirmed after inference and both provenance entries are retained.","correctness":{"factual":true,"temporal":true,"relationship":true,"ambiguity":null,"conflict":true,"negative_knowledge":null,"provenance":true},"unsupported_claims":0,"evidence_used":["M-E0448","M-E0449","MREL-CONFIRM","E0448","E0449"],"retrieved_chunks":[],"input_tokens":null,"latency_ms":null},
  {"agent_id":"copilot","condition":"V6+RAW","case_id":"V71-NEG-01","query_category":"negative_knowledge","answer":"MongoDB was not discussed in the billing migration review. The later MongoDB mention was in a different project, and the review is explicitly complete for this negative claim.","correctness":{"factual":true,"temporal":null,"relationship":true,"ambiguity":null,"conflict":null,"negative_knowledge":true,"provenance":true},"unsupported_claims":0,"evidence_used":["M-E0548","M-E1102","MNEG-MONGO","E0548","E1102"],"retrieved_chunks":[],"input_tokens":null,"latency_ms":null},
  {"agent_id":"copilot","condition":"V6+RAW","case_id":"V71-PROV-01","query_category":"provenance","answer":"Rahul observed the failed DynamoDB migration. Claude later confirmed the failure after reviewing integration-test output, then Claude inferred that transaction semantics were involved, and Rahul explicitly confirmed transaction semantics as the reason. Copilot later read the notes and preserved the decision and failed attempt.","correctness":{"factual":true,"temporal":true,"relationship":true,"ambiguity":null,"conflict":null,"negative_knowledge":null,"provenance":true},"unsupported_claims":0,"evidence_used":["M-E0067","M-E0141","M-E0448","M-E0449","M-E0802","MPROV-BILLING","E0067","E0141","E0448","E0449","E0802"],"retrieved_chunks":[],"input_tokens":null,"latency_ms":null}
]
