[
  {
    "agent_id": "claude",
    "condition": "RAW",
    "case_id": "V71-HIST-01",
    "query_category": "historical_recall",
    "answer": "PostgreSQL was chosen for the billing service because auditability mattered more than DynamoDB's lower migration effort. DynamoDB was tried for the billing prototype but the migration failed because conditional-update semantics did not match the existing transaction flow; Claude later confirmed the failure after reviewing integration-test output.",
    "correctness": {
      "factual": true,
      "temporal": null,
      "relationship": true,
      "ambiguity": null,
      "conflict": null,
      "negative_knowledge": null,
      "provenance": true
    },
    "unsupported_claims": 0,
    "evidence_used": ["E0005", "E0067", "E0141"],
    "retrieved_chunks": [],
    "input_tokens": null,
    "latency_ms": null
  },
  {
    "agent_id": "claude",
    "condition": "RAW",
    "case_id": "V71-DEC-01",
    "query_category": "decision_continuity",
    "answer": "Redis caching was tested to reduce API latency. It was abandoned because the experiment increased cache invalidation complexity. It was later retried with a narrower cache scope, but the latency improvement was negligible.",
    "correctness": {
      "factual": true,
      "temporal": true,
      "relationship": true,
      "ambiguity": null,
      "conflict": null,
      "negative_knowledge": null,
      "provenance": null
    },
    "unsupported_claims": 0,
    "evidence_used": ["E0178", "E0263", "E0731"],
    "retrieved_chunks": [],
    "input_tokens": null,
    "latency_ms": null
  },
  {
    "agent_id": "claude",
    "condition": "RAW",
    "case_id": "V71-ACT-01",
    "query_category": "action_outcome",
    "answer": "The first invoice export attempt timed out after 18 minutes. Exports were then switched to asynchronous jobs. The first full customer batch subsequently completed successfully via the asynchronous approach.",
    "correctness": {
      "factual": true,
      "temporal": true,
      "relationship": null,
      "ambiguity": null,
      "conflict": null,
      "negative_knowledge": null,
      "provenance": null
    },
    "unsupported_claims": 0,
    "evidence_used": ["E0356", "E0622", "E1033"],
    "retrieved_chunks": [],
    "input_tokens": null,
    "latency_ms": null
  },
  {
    "agent_id": "claude",
    "condition": "RAW",
    "case_id": "V71-TIME-01",
    "query_category": "temporal_state",
    "answer": "polling (temporary compatibility path, from 2026-02-17) -> moved to webhooks (2026-03-11) -> webhooks disabled temporarily due to duplicate-delivery reconciliation errors (2026-05-20) -> webhooks re-enabled after idempotency handling was deployed (2026-06-03). Latest known state: webhooks re-enabled/active.",
    "correctness": {
      "factual": true,
      "temporal": true,
      "relationship": null,
      "ambiguity": null,
      "conflict": null,
      "negative_knowledge": null,
      "provenance": null
    },
    "unsupported_claims": 0,
    "evidence_used": ["E0233", "E0401", "E0887", "E1190"],
    "retrieved_chunks": [],
    "input_tokens": null,
    "latency_ms": null
  },
  {
    "agent_id": "claude",
    "condition": "RAW",
    "case_id": "V71-AMB-01",
    "query_category": "ambiguity",
    "answer": "The conversation does not establish whether \"he\" refers to Rahul or Arjun; the reference remains unresolved.",
    "correctness": {
      "factual": null,
      "temporal": null,
      "relationship": null,
      "ambiguity": true,
      "conflict": null,
      "negative_knowledge": null,
      "provenance": null
    },
    "unsupported_claims": 0,
    "evidence_used": ["E0312", "E0515"],
    "retrieved_chunks": [],
    "input_tokens": null,
    "latency_ms": null
  },
  {
    "agent_id": "claude",
    "condition": "RAW",
    "case_id": "V71-CONFLICT-01",
    "query_category": "conflict",
    "answer": "The reason began as an inference: Claude inferred that the migration failure was related to transaction semantics. Rahul later explicitly confirmed transaction semantics were the reason the DynamoDB migration was abandoned. So the belief moved from inferred to confirmed, with both steps preserved.",
    "correctness": {
      "factual": null,
      "temporal": null,
      "relationship": null,
      "ambiguity": null,
      "conflict": true,
      "negative_knowledge": null,
      "provenance": true
    },
    "unsupported_claims": 0,
    "evidence_used": ["E0448", "E0449"],
    "retrieved_chunks": [],
    "input_tokens": null,
    "latency_ms": null
  },
  {
    "agent_id": "claude",
    "condition": "RAW",
    "case_id": "V71-NEG-01",
    "query_category": "negative_knowledge",
    "answer": "MongoDB was not discussed in the billing migration review. The only MongoDB mention on record belongs to a different project, not the billing migration review.",
    "correctness": {
      "factual": null,
      "temporal": null,
      "relationship": null,
      "ambiguity": null,
      "conflict": null,
      "negative_knowledge": true,
      "provenance": null
    },
    "unsupported_claims": 0,
    "evidence_used": ["E0548", "E1102"],
    "retrieved_chunks": [],
    "input_tokens": null,
    "latency_ms": null
  },
  {
    "agent_id": "claude",
    "condition": "RAW",
    "case_id": "V71-PROV-01",
    "query_category": "provenance",
    "answer": "Rahul originally observed the failed DynamoDB migration. Claude confirmed it after reviewing integration-test output. Claude later inferred the failure was related to transaction semantics, and Rahul explicitly confirmed transaction semantics as the reason. Later, Copilot read the billing migration notes and preserved the PostgreSQL decision and failed DynamoDB attempt in memory -- a later memory-read step, not a new independent observation.",
    "correctness": {
      "factual": null,
      "temporal": null,
      "relationship": null,
      "ambiguity": null,
      "conflict": null,
      "negative_knowledge": null,
      "provenance": true
    },
    "unsupported_claims": 0,
    "evidence_used": ["E0067", "E0141", "E0448", "E0449", "E0802"],
    "retrieved_chunks": [],
    "input_tokens": null,
    "latency_ms": null
  }
]
