[
{"agent_id":"copilot","condition":"V6","case_id":"V74-HIST-01","query_category":"historical_recall","answer":"PostgreSQL was chosen for auditability over migration effort. DynamoDB failed because conditional-update and transaction semantics did not fit the transaction flow, and the failure was confirmed by integration-test output.","correctness":{"factual":true,"temporal":true,"relationship":true,"ambiguity":null,"conflict":null,"negative_knowledge":null,"provenance":true},"unsupported_claims":0,"evidence_used":["R1","E0014","E0068","E0142"],"input_tokens":null,"latency_ms":null},
{"agent_id":"copilot","condition":"V6","case_id":"V74-DEC-01","query_category":"decision_continuity","answer":"Redis was tested, abandoned after cache-invalidation complexity increased, and retried with narrower scope with negligible latency improvement.","correctness":{"factual":true,"temporal":true,"relationship":true,"ambiguity":null,"conflict":null,"negative_knowledge":null,"provenance":null},"unsupported_claims":0,"evidence_used":["R2","E0179","E0264","E0732"],"input_tokens":null,"latency_ms":null},
{"agent_id":"copilot","condition":"V6","case_id":"V74-ACT-01","query_category":"action_outcome","answer":"The first invoice export timed out after 18 minutes, exports switched to asynchronous jobs, and the first full customer batch later succeeded.","correctness":{"factual":true,"temporal":true,"relationship":true,"ambiguity":null,"conflict":null,"negative_knowledge":null,"provenance":null},"unsupported_claims":0,"evidence_used":["R3","E0357","E0623","E1034"],"input_tokens":null,"latency_ms":null},
{"agent_id":"copilot","condition":"V6","case_id":"V74-TIME-01","query_category":"temporal_state","answer":"Webhook migration moved from polling to webhooks, webhooks were temporarily disabled due duplicate-delivery reconciliation errors, and were re-enabled after idempotency handling. Latest state is re-enabled webhooks.","correctness":{"factual":true,"temporal":true,"relationship":true,"ambiguity":null,"conflict":null,"negative_knowledge":null,"provenance":null},"unsupported_claims":0,"evidence_used":["R4","E0402","E0888","E1191"],"input_tokens":null,"latency_ms":null},
{"agent_id":"copilot","condition":"V6","case_id":"V74-AMB-01","query_category":"ambiguity","answer":"The deployment-window pronoun 'he' remains unresolved between Rahul and Arjun.","correctness":{"factual":true,"temporal":null,"relationship":null,"ambiguity":true,"conflict":null,"negative_knowledge":null,"provenance":true},"unsupported_claims":0,"evidence_used":["R5","E0516"],"input_tokens":null,"latency_ms":null},
{"agent_id":"copilot","condition":"V6","case_id":"V74-BELIEF-01","query_category":"belief","answer":"Transaction semantics began as an inference by Claude and were later confirmed by Rahul as the reason for abandoning DynamoDB.","correctness":{"factual":true,"temporal":true,"relationship":true,"ambiguity":null,"conflict":true,"negative_knowledge":null,"provenance":true},"unsupported_claims":0,"evidence_used":["R1","E0449","E0450"],"input_tokens":null,"latency_ms":null},
{"agent_id":"copilot","condition":"V6","case_id":"V74-NEG-01","query_category":"negative_knowledge","answer":"MongoDB was not discussed in the billing migration review; the later MongoDB proposal belonged to a different project.","correctness":{"factual":true,"temporal":null,"relationship":true,"ambiguity":null,"conflict":null,"negative_knowledge":true,"provenance":true},"unsupported_claims":0,"evidence_used":["R6","E0549","E1103"],"input_tokens":null,"latency_ms":null},
{"agent_id":"copilot","condition":"V6","case_id":"V74-PROV-01","query_category":"provenance","answer":"Rahul made the PostgreSQL decision and observed the DynamoDB attempt/failure; Claude confirmed the failure, Claude inferred transaction semantics, Rahul confirmed that reason, and Copilot later preserved the history.","correctness":{"factual":true,"temporal":true,"relationship":true,"ambiguity":null,"conflict":null,"negative_knowledge":null,"provenance":true},"unsupported_claims":0,"evidence_used":["R1","E0068","E0142","E0449","E0450","E0803"],"input_tokens":null,"latency_ms":null}
]
