[
  {"agent_id":"copilot","condition":"RAW","case_id":"V71-HIST-01","query_category":"historical_recall","answer":"PostgreSQL was chosen for billing because auditability mattered more than DynamoDB's lower migration effort. DynamoDB was tried, but the migration failed because conditional-update semantics did not match the existing transaction flow; Claude later confirmed the failure after reviewing integration-test output.","correctness":{"factual":true,"temporal":true,"relationship":true,"ambiguity":null,"conflict":null,"negative_knowledge":null,"provenance":true},"unsupported_claims":0,"evidence_used":["E0005","E0067","E0141"],"retrieved_chunks":[],"input_tokens":null,"latency_ms":null},
  {"agent_id":"copilot","condition":"RAW","case_id":"V71-DEC-01","query_category":"decision_continuity","answer":"The initial Redis test increased cache invalidation complexity, so it was abandoned. A narrower retry later produced negligible latency improvement.","correctness":{"factual":true,"temporal":true,"relationship":true,"ambiguity":null,"conflict":null,"negative_knowledge":null,"provenance":null},"unsupported_claims":0,"evidence_used":["E0178","E0263","E0731"],"retrieved_chunks":[],"input_tokens":null,"latency_ms":null},
  {"agent_id":"copilot","condition":"RAW","case_id":"V71-ACT-01","query_category":"action_outcome","answer":"The first invoice export attempt timed out after 18 minutes. Exports were switched to asynchronous jobs, and the first full customer batch then completed successfully.","correctness":{"factual":true,"temporal":true,"relationship":true,"ambiguity":null,"conflict":null,"negative_knowledge":null,"provenance":null},"unsupported_claims":0,"evidence_used":["E0356","E0622","E1033"],"retrieved_chunks":[],"input_tokens":null,"latency_ms":null},
  {"agent_id":"copilot","condition":"RAW","case_id":"V71-TIME-01","query_category":"temporal_state","answer":"The sequence was: polling as the temporary compatibility path, then migration to webhooks, then temporary webhook disablement because duplicate deliveries caused reconciliation errors, and finally webhook re-enablement after idempotency handling was deployed. The latest state is webhooks re-enabled.","correctness":{"factual":true,"temporal":true,"relationship":true,"ambiguity":null,"conflict":null,"negative_knowledge":null,"provenance":null},"unsupported_claims":0,"evidence_used":["E0233","E0401","E0887","E1190"],"retrieved_chunks":[],"input_tokens":null,"latency_ms":null},
  {"agent_id":"copilot","condition":"RAW","case_id":"V71-AMB-01","query_category":"ambiguity","answer":"The reference remains unresolved between Rahul and Arjun; the evidence does not establish who 'he' referred to.","correctness":{"factual":true,"temporal":null,"relationship":null,"ambiguity":true,"conflict":null,"negative_knowledge":null,"provenance":null},"unsupported_claims":0,"evidence_used":["E0312","E0515"],"retrieved_chunks":[],"input_tokens":null,"latency_ms":null},
  {"agent_id":"copilot","condition":"RAW","case_id":"V71-CONFLICT-01","query_category":"conflict","answer":"Claude initially inferred that transaction semantics were involved. Rahul later confirmed that transaction semantics were the reason the DynamoDB migration was abandoned. The belief history is therefore confirmed after inference, with both sources preserved.","correctness":{"factual":true,"temporal":true,"relationship":true,"ambiguity":null,"conflict":true,"negative_knowledge":null,"provenance":true},"unsupported_claims":0,"evidence_used":["E0448","E0449"],"retrieved_chunks":[],"input_tokens":null,"latency_ms":null},
  {"agent_id":"copilot","condition":"RAW","case_id":"V71-NEG-01","query_category":"negative_knowledge","answer":"MongoDB was not discussed as a billing-migration option in that review. E1102 was a MongoDB mention from a different project, not that review.","correctness":{"factual":true,"temporal":null,"relationship":true,"ambiguity":null,"conflict":null,"negative_knowledge":true,"provenance":null},"unsupported_claims":0,"evidence_used":["E0548","E1102"],"retrieved_chunks":[],"input_tokens":null,"latency_ms":null},
  {"agent_id":"copilot","condition":"RAW","case_id":"V71-PROV-01","query_category":"provenance","answer":"Rahul observed the failed DynamoDB migration. Claude later confirmed the failure after reviewing integration-test output, then Claude inferred that transaction semantics were involved, and Rahul explicitly confirmed transaction semantics as the reason. Copilot later read the notes and preserved the decision and failed attempt.","correctness":{"factual":true,"temporal":true,"relationship":true,"ambiguity":null,"conflict":null,"negative_knowledge":null,"provenance":true},"unsupported_claims":0,"evidence_used":["E0067","E0141","E0448","E0449","E0802"],"retrieved_chunks":[],"input_tokens":null,"latency_ms":null}
]
