[
{"agent_id":"copilot","condition":"V6","case_id":"V71-HIST-01","query_category":"historical_recall","answer":"PostgreSQL was chosen for auditability over DynamoDB migration effort. DynamoDB failed because conditional-update semantics did not match the transaction flow, and Claude later confirmed the failure.","correctness":{"factual":true,"temporal":true,"relationship":true,"ambiguity":null,"conflict":null,"negative_knowledge":null,"provenance":true},"unsupported_claims":0,"evidence_used":["memory-0001","memory-0002","memory-0003","E0005","E0067","E0141"],"input_tokens":null,"latency_ms":null},
{"agent_id":"copilot","condition":"V6","case_id":"V71-DEC-01","query_category":"decision_continuity","answer":"Redis was abandoned after increased cache invalidation complexity; a narrower retry later produced negligible latency improvement.","correctness":{"factual":true,"temporal":true,"relationship":true,"ambiguity":null,"conflict":null,"negative_knowledge":null,"provenance":null},"unsupported_claims":0,"evidence_used":["memory-0004","memory-0006","memory-0015","E0178","E0263","E0731"],"input_tokens":null,"latency_ms":null},
{"agent_id":"copilot","condition":"V6","case_id":"V71-ACT-01","query_category":"action_outcome","answer":"The first invoice export timed out after 18 minutes, exports were switched to asynchronous jobs, and the first full customer batch completed successfully.","correctness":{"factual":true,"temporal":true,"relationship":true,"ambiguity":null,"conflict":null,"negative_knowledge":null,"provenance":null},"unsupported_claims":0,"evidence_used":["memory-0008","memory-0014","memory-0018","E0356","E0622","E1033"],"input_tokens":null,"latency_ms":null},
{"agent_id":"copilot","condition":"V6","case_id":"V71-TIME-01","query_category":"temporal_state","answer":"The webhook state evolved from polling, to webhooks, to temporary disablement due duplicate deliveries and reconciliation errors, then to re-enabled webhooks after idempotency handling. Latest state: webhooks re-enabled.","correctness":{"factual":true,"temporal":true,"relationship":true,"ambiguity":null,"conflict":null,"negative_knowledge":null,"provenance":null},"unsupported_claims":0,"evidence_used":["memory-0005","memory-0009","memory-0017","memory-0019","E0233","E0401","E0887","E1190"],"input_tokens":null,"latency_ms":null},
{"agent_id":"copilot","condition":"V6","case_id":"V71-AMB-01","query_category":"ambiguity","answer":"The reference remains unresolved between Rahul and Arjun.","correctness":{"factual":true,"temporal":null,"relationship":null,"ambiguity":true,"conflict":null,"negative_knowledge":null,"provenance":true},"unsupported_claims":0,"evidence_used":["memory-0007","memory-0012","E0312","E0515"],"input_tokens":null,"latency_ms":null},
{"agent_id":"copilot","condition":"V6","case_id":"V71-CONFLICT-01","query_category":"conflict","answer":"Claude inferred that transaction semantics were involved, and Rahul later confirmed they were the reason for abandoning DynamoDB; both belief stages are preserved.","correctness":{"factual":true,"temporal":true,"relationship":true,"ambiguity":null,"conflict":true,"negative_knowledge":null,"provenance":true},"unsupported_claims":0,"evidence_used":["memory-0010","memory-0011","E0448","E0449"],"input_tokens":null,"latency_ms":null},
{"agent_id":"copilot","condition":"V6","case_id":"V71-NEG-01","query_category":"negative_knowledge","answer":"MongoDB was not discussed in the billing migration review; the later MongoDB mention belonged to a different project.","correctness":{"factual":true,"temporal":null,"relationship":true,"ambiguity":null,"conflict":null,"negative_knowledge":true,"provenance":true},"unsupported_claims":0,"evidence_used":["memory-0013","memory-0019","E0548","E1102"],"input_tokens":null,"latency_ms":null},
{"agent_id":"copilot","condition":"V6","case_id":"V71-PROV-01","query_category":"provenance","answer":"Rahul observed the failed migration; Claude confirmed it after integration-test review; Claude later inferred transaction semantics; Rahul explicitly confirmed them; Copilot later preserved the decision and failed attempt.","correctness":{"factual":true,"temporal":true,"relationship":null,"ambiguity":null,"conflict":null,"negative_knowledge":null,"provenance":true},"unsupported_claims":0,"evidence_used":["memory-0002","memory-0003","memory-0010","memory-0011","memory-0016","E0067","E0141","E0448","E0449","E0802"],"input_tokens":null,"latency_ms":null}
]
