[
{"agent_id":"copilot","condition":"RAG","case_id":"V74-HIST-01","query_category":"historical_recall","answer":"Retrieved evidence supports the PostgreSQL choice and DynamoDB attempt/failure, but the confirmation event was not retrieved, so the full confirmation history cannot be established.","correctness":{"factual":true,"temporal":true,"relationship":true,"ambiguity":null,"conflict":null,"negative_knowledge":null,"provenance":false},"unsupported_claims":0,"evidence_used":["C0000","C0001","C0004","C0009","C0010","C0015"],"retrieved_chunks":[{"chunk_id":"C0000","score":1.0},{"chunk_id":"C0001","score":1.0},{"chunk_id":"C0004","score":1.0},{"chunk_id":"C0009","score":1.0},{"chunk_id":"C0010","score":1.0},{"chunk_id":"C0015","score":1.0}],"input_tokens":null,"latency_ms":null},
{"agent_id":"copilot","condition":"RAG","case_id":"V74-DEC-01","query_category":"decision_continuity","answer":"The retrieved evidence supports that Redis was tested and abandoned after cache-invalidation complexity, but the narrower retry outcome was not retrieved.","correctness":{"factual":true,"temporal":false,"relationship":true,"ambiguity":null,"conflict":null,"negative_knowledge":null,"provenance":null},"unsupported_claims":0,"evidence_used":["C0034","C0025","C0030","C0035","C0051","C0053"],"retrieved_chunks":[{"chunk_id":"C0034","score":1.0},{"chunk_id":"C0025","score":0.666667},{"chunk_id":"C0030","score":0.666667},{"chunk_id":"C0035","score":0.666667},{"chunk_id":"C0051","score":0.666667},{"chunk_id":"C0053","score":0.666667}],"input_tokens":null,"latency_ms":null},
{"agent_id":"copilot","condition":"RAG","case_id":"V74-ACT-01","query_category":"action_outcome","answer":"The retrieved evidence contains the asynchronous switch and successful full batch, but misses the initial timeout event, so the complete failure-to-success history is incomplete.","correctness":{"factual":true,"temporal":false,"relationship":true,"ambiguity":null,"conflict":null,"negative_knowledge":null,"provenance":null},"unsupported_claims":0,"evidence_used":["C0025","C0035","C0053","C0063","C0034","C0051"],"retrieved_chunks":[{"chunk_id":"C0025","score":0.948683},{"chunk_id":"C0035","score":0.948683},{"chunk_id":"C0053","score":0.948683},{"chunk_id":"C0063","score":0.948683},{"chunk_id":"C0034","score":0.632456},{"chunk_id":"C0051","score":0.632456}],"input_tokens":null,"latency_ms":null},
{"agent_id":"copilot","condition":"RAG","case_id":"V74-TIME-01","query_category":"temporal_state","answer":"The retrieved chunks do not contain the required webhook state events, so the webhook timeline and latest state cannot be established from RAG evidence.","correctness":{"factual":false,"temporal":false,"relationship":false,"ambiguity":null,"conflict":null,"negative_knowledge":null,"provenance":null},"unsupported_claims":0,"evidence_used":["C0063","C0094","C0000","C0001","C0002","C0004"],"retrieved_chunks":[{"chunk_id":"C0063","score":1.133893},{"chunk_id":"C0094","score":1.133893},{"chunk_id":"C0000","score":0.755929},{"chunk_id":"C0001","score":0.755929},{"chunk_id":"C0002","score":0.755929},{"chunk_id":"C0004","score":0.755929}],"input_tokens":null,"latency_ms":null},
{"agent_id":"copilot","condition":"RAG","case_id":"V74-AMB-01","query_category":"ambiguity","answer":"The retrieved evidence includes the unresolved deployment-window pronoun and does not resolve Rahul versus Arjun.","correctness":{"factual":true,"temporal":null,"relationship":null,"ambiguity":true,"conflict":null,"negative_knowledge":null,"provenance":null},"unsupported_claims":0,"evidence_used":["C0001","C0010","C0013","C0023","C0044","C0049"],"retrieved_chunks":[{"chunk_id":"C0001","score":1.333333},{"chunk_id":"C0010","score":1.333333},{"chunk_id":"C0013","score":1.333333},{"chunk_id":"C0023","score":1.333333},{"chunk_id":"C0044","score":1.333333},{"chunk_id":"C0049","score":1.333333}],"input_tokens":null,"latency_ms":null},
{"agent_id":"copilot","condition":"RAG","case_id":"V74-BELIEF-01","query_category":"belief","answer":"The retrieved evidence contains Rahul's later confirmation, but not Claude's earlier inference, so the full inference-to-confirmation history is incomplete.","correctness":{"factual":true,"temporal":false,"relationship":true,"ambiguity":null,"conflict":false,"negative_knowledge":null,"provenance":false},"unsupported_claims":0,"evidence_used":["C0037","C0015","C0002","C0003","C0004","C0021"],"retrieved_chunks":[{"chunk_id":"C0037","score":1.666667},{"chunk_id":"C0015","score":1.333333},{"chunk_id":"C0002","score":1.0},{"chunk_id":"C0003","score":1.0},{"chunk_id":"C0004","score":1.0},{"chunk_id":"C0021","score":1.0}],"input_tokens":null,"latency_ms":null},
{"agent_id":"copilot","condition":"RAG","case_id":"V74-NEG-01","query_category":"negative_knowledge","answer":"The retrieved evidence supports that MongoDB was not discussed in the billing migration review and that a later mention was in another project.","correctness":{"factual":true,"temporal":null,"relationship":true,"ambiguity":null,"conflict":null,"negative_knowledge":true,"provenance":null},"unsupported_claims":0,"evidence_used":["C0051","C0080","C0002","C0007","C0017","C0021"],"retrieved_chunks":[{"chunk_id":"C0051","score":2.828427},{"chunk_id":"C0080","score":2.828427},{"chunk_id":"C0002","score":2.474874},{"chunk_id":"C0007","score":2.474874},{"chunk_id":"C0017","score":2.474874},{"chunk_id":"C0021","score":2.474874}],"input_tokens":null,"latency_ms":null},
{"agent_id":"copilot","condition":"RAG","case_id":"V74-PROV-01","query_category":"provenance","answer":"Retrieved evidence includes Rahul's later confirmation and Copilot's later preservation note, but does not retrieve the initial failure observation, Claude confirmation, or inference, so provenance is incomplete.","correctness":{"factual":true,"temporal":false,"relationship":false,"ambiguity":null,"conflict":false,"negative_knowledge":null,"provenance":false},"unsupported_claims":0,"evidence_used":["C0035","C0051","C0059","C0000","C0006","C0007"],"retrieved_chunks":[{"chunk_id":"C0035","score":2.020726},{"chunk_id":"C0051","score":2.020726},{"chunk_id":"C0059","score":2.020726},{"chunk_id":"C0000","score":1.732051},{"chunk_id":"C0006","score":1.732051},{"chunk_id":"C0007","score":1.732051}],"input_tokens":null,"latency_ms":null}
]
